{
  "contract": {
    "id": "workspai.graph.inventory-surface",
    "version": "1"
  },
  "classes": [
    "source",
    "repository-configuration",
    "generated",
    "declared-generated",
    "observed-generated",
    "vendored",
    "vcs-metadata",
    "ignored",
    "policy-excluded",
    "binary",
    "unsafe-path",
    "inaccessible",
    "resource-bounded",
    "unsupported",
    "unknown-classification"
  ],
  "vcsMetadataDirectoryMarkers": [".git", ".hg", ".svn"],
  "dependencyStoreDirectoryMarkers": ["node_modules"],
  "environmentStoreDirectoryMarkers": [".venv"],
  "ambiguousOutputDirectoryNames": [
    "dist",
    "build",
    "coverage",
    "target",
    "bin",
    "obj",
    "out",
    "generated"
  ],
  "ambiguousVendorDirectoryNames": ["vendor", "third_party", "venv"],
  "walkSkipEvidenceKinds": [
    "universal-vcs-metadata",
    "universal-dependency-store",
    "universal-environment-store",
    "host-inventory-exclusion",
    "resource-budget"
  ],
  "omittedSubtreeCountStates": ["not-enumerated"],
  "omittedSubtreeByteStates": ["not-measured"],
  "omittedSubtreeEnumerationStates": ["not-enumerated", "partially-enumerated"],
  "policyMaterialKind": "inventory-walk-policy",
  "policyMaterialBudgetKeys": [
    "maxFiles",
    "maxTotalBytes",
    "maxFileBytes",
    "maxDepth",
    "maxDirectoryEntries"
  ],
  "hiddenDirectoryDefault": "repository-configuration",
  "generatedArtifactClasses": ["generated", "declared-generated", "observed-generated", "vendored"],
  "ambiguousDirectoryDefault": "source"
}
